{
  "schema_version": "0.1.0",
  "id": "filler.thinking.01",
  "intent": "filler.thinking",
  "class": "filler",
  "variant_group": "filler.thinking",
  "speech": {
    "text": "えーっと…",
    "audio_ref": "audio://starter/filler-thinking-01.opus",
    "duration_ms": 640,
    "viseme_ref": "viseme/filler-thinking-01.json"
  },
  "expression": {
    "preset": "thinking_soft",
    "intensity": 0.4
  },
  "gesture": {
    "preset": "tilt_head_small",
    "amplitude": 0.5
  },
  "gaze": "camera",
  "timeline": [
    {
      "at_ms": 0,
      "event": "expression.start",
      "payload": {
        "preset": "thinking_soft"
      }
    },
    {
      "at_ms": 40,
      "event": "speech.start"
    },
    {
      "at_ms": 120,
      "event": "gesture.start",
      "payload": {
        "preset": "tilt_head_small"
      }
    },
    {
      "at_ms": 320,
      "event": "phrase.boundary"
    },
    {
      "at_ms": 680,
      "event": "speech.end"
    }
  ],
  "interrupt_points_ms": [
    320,
    640
  ],
  "variation": {
    "speed_pct": 6,
    "amplitude_pct": 6,
    "start_delay_ms": 60
  },
  "compatibility": {
    "compiler_version": "0.1.0",
    "voice_model": "example-voice-v1",
    "avatar_profile": "example-live2d-v1",
    "viseme_mapping": "ja-5vowel-v1",
    "motion_library": "starter-v1"
  },
  "semantic_embedding": {
    "model": "starter-semantic",
    "model_version": "1",
    "vector": [0.0, 0.0, 1.0]
  },
  "provenance": {
    "generated": false,
    "generator": null,
    "created_at": "2026-09-24T00:00:00Z"
  }
}
