{
  "schema_version": "0.1.0",
  "id": "reaction.surprise.01",
  "intent": "reaction.surprise",
  "class": "reaction",
  "variant_group": "reaction.surprise",
  "speech": {
    "text": "えっ、本当に！？",
    "audio_ref": "audio://starter/reaction-surprise-01.opus",
    "duration_ms": 900,
    "viseme_ref": "viseme/reaction-surprise-01.json"
  },
  "expression": {
    "preset": "surprise_medium",
    "intensity": 0.72
  },
  "gesture": {
    "preset": "recoil_small",
    "amplitude": 1
  },
  "gaze": "camera",
  "timeline": [
    {
      "at_ms": 0,
      "event": "expression.start",
      "payload": {
        "preset": "surprise_medium"
      }
    },
    {
      "at_ms": 90,
      "event": "speech.start"
    },
    {
      "at_ms": 120,
      "event": "gesture.start",
      "payload": {
        "preset": "recoil_small"
      }
    },
    {
      "at_ms": 480,
      "event": "phrase.boundary"
    },
    {
      "at_ms": 990,
      "event": "speech.end"
    }
  ],
  "interrupt_points_ms": [
    480,
    900
  ],
  "variation": {
    "speed_pct": 6,
    "amplitude_pct": 6,
    "start_delay_ms": 60
  },
  "compatibility": {
    "compiler_version": "0.1.0",
    "voice_model": "example-voice-v1",
    "avatar_profile": "example-live2d-v1",
    "viseme_mapping": "ja-5vowel-v1",
    "motion_library": "starter-v1"
  },
  "provenance": {
    "generated": false,
    "generator": null,
    "created_at": "2026-09-24T00:00:00Z"
  }
}
