{
  "schema_version": "0.1.0",
  "id": "reaction.surprise.01",
  "intent": "surprise",
  "class": "reaction",
  "variant_group": "surprise",
  "speech": {
    "text": "え、嘘でしょう！",
    "audio_ref": "audio://reactions/surprise-01.opus",
    "duration_ms": 940,
    "viseme_ref": "viseme://reactions/surprise-01.json"
  },
  "expression": {
    "preset": "eyes_wide",
    "intensity": 0.8
  },
  "gesture": {
    "preset": "lean_back_small",
    "amplitude": 0.6
  },
  "gaze": "camera",
  "timeline": [
    { "at_ms": 0, "event": "expression.start", "payload": { "preset": "eyes_wide" } },
    { "at_ms": 0, "event": "speech.start" },
    { "at_ms": 120, "event": "gesture.start", "payload": { "preset": "lean_back_small" } },
    { "at_ms": 620, "event": "phrase.boundary" },
    { "at_ms": 940, "event": "speech.end" }
  ],
  "interrupt_points_ms": [0, 620, 940],
  "variation": {
    "speed_pct": 10,
    "amplitude_pct": 15,
    "start_delay_ms": 120
  },
  "compatibility": {
    "compiler_version": "0.1.0",
    "voice_model": "example-voice-v1",
    "avatar_profile": "example-avatar-v1",
    "viseme_mapping": "default-1.0",
    "motion_library": "base-1.0"
  },
  "provenance": {
    "generated": false,
    "generator": null,
    "created_at": "2026-09-20T10:00:00Z"
  }
}
